{
  "$schema": "./redaction-v1.schema.json",
  "policy": "redaction-v1",
  "version": 1,
  "title": "Redaction policy v1: what never goes to the cloud",
  "basis": [
    "sync.md section 5, as amended by BRD2 section 11.1",
    "BRD2 D2-32, Q2-02 and Q2-18",
    "review findings PS-01, PS-02, PS-03, PS-06, PS-15, SI-16 and SI-19"
  ],
  "phases": [
    { "id": "classify", "order": 1, "summary": "Decide which primary objects are excluded or held, from their own flags, types and files. No other object is needed." },
    { "id": "elements", "order": 2, "summary": "Remove private secondary elements from each kept object." },
    { "id": "fields", "order": 3, "summary": "Reduce dates, blank local-only fields and round coordinates on each kept object." },
    { "id": "scan", "order": 4, "summary": "Scan the outgoing free text. A hit holds a field of an object the cloud already has, or the whole object when it is new." },
    { "id": "orphans", "order": 5, "summary": "Exclude, until nothing more changes, every object that only excluded or held objects reference." },
    { "id": "references", "order": 6, "summary": "Filter references to excluded or held objects, and re-point places." }
  ],
  "birthLike": {
    "summary": "The one list of birth-like events. The projection, the server validator, the edit guard and the renderer import this predicate; nobody keeps a local list (D2-32).",
    "eventTypes": [
      { "value": 12, "name": "Birth" },
      { "value": 14, "name": "Adult Christening" },
      { "value": 15, "name": "Baptism" },
      { "value": 18, "name": "Bless" },
      { "value": 22, "name": "Christen" },
      { "value": 45, "name": "Stillbirth" }
    ],
    "customType": {
      "value": 0,
      "pattern": "birth|bapt|christen|naissance|geburt|nacimiento",
      "flags": "i"
    },
    "birthRefIndex": true,
    "appliesTo": "everyone, living or deceased"
  },
  "dates": {
    "dayMonthIndexes": [0, 1, 4, 5],
    "yearIndexes": [2, 6],
    "bareYearTextPattern": "^[0-9]{1,4}$",
    "textOnlyModifier": 6,
    "textOnlyYearPattern": "(?:^|[^0-9])([0-9]{4})(?![0-9])",
    "sortvalCalendars": [0, 1],
    "nameTypeBirth": 2
  },
  "attributes": {
    "ageAndTime": [
      { "value": 10, "name": "Age" },
      { "value": 11, "name": "Father Age" },
      { "value": 12, "name": "Mother Age" },
      { "value": 14, "name": "Time" }
    ],
    "governmentId": [
      { "value": 6, "name": "Social Security Number" },
      { "value": 3, "name": "Identification Number" }
    ]
  },
  "urls": {
    "emailType": 1,
    "schemes": ["mailto", "tel", "sms", "callto", "facetime", "skype", "whatsapp"],
    "hosts": ["m.me", "ig.me", "wa.me", "t.me", "telegram.me", "messenger.com", "api.whatsapp.com", "signal.me"],
    "paths": [{ "host": "instagram.com", "prefix": "/m/" }]
  },
  "places": {
    "excludedTypes": [
      { "value": 7, "name": "Street" },
      { "value": 18, "name": "Farm" },
      { "value": 19, "name": "Building" },
      { "value": 20, "name": "Number" }
    ],
    "customHomeLike": {
      "value": 0,
      "pattern": "house|home|residence|address|apartment|apt|lot|farm",
      "flags": "i"
    },
    "administrativeTypes": [
      { "value": 1, "name": "Country" },
      { "value": 2, "name": "State" },
      { "value": 3, "name": "County" },
      { "value": 8, "name": "Province" },
      { "value": 9, "name": "Region" },
      { "value": 10, "name": "Department" }
    ],
    "locationFields": ["street", "locality", "postal", "phone"],
    "coordinateDecimals": 2,
    "coordinatePattern": "^[+-]?[0-9]+(\\.[0-9]+)?$"
  },
  "media": {
    "heldMime": ["application/pdf"],
    "exifGpsMime": ["image/jpeg", "image/png", "image/tiff"],
    "rectRange": [0, 100],
    "fullFrameRect": [0, 0, 100, 100]
  },
  "scan": {
    "kinds": ["phone", "email", "street_address", "po_box", "contact_url", "dob_heuristic"],
    "desktopOnlyKinds": ["dob_exact"],
    "dobWindow": 60,
    "fields": [
      { "class": "Note", "path": "/text/string" },
      { "class": "Event", "path": "/description" },
      { "class": "Media", "path": "/desc" },
      { "class": "Attribute", "path": "/value" },
      { "class": "SrcAttribute", "path": "/value" },
      { "class": "Url", "path": "/desc" },
      { "class": "Url", "path": "/path" },
      { "class": "Citation", "path": "/page" },
      { "class": "Source", "path": "/title" },
      { "class": "Source", "path": "/author" },
      { "class": "Source", "path": "/pubinfo" },
      { "class": "Source", "path": "/abbrev" },
      { "class": "Repository", "path": "/name" },
      { "class": "PersonRef", "path": "/rel" },
      { "class": "Name", "path": "/first_name" },
      { "class": "Name", "path": "/call" },
      { "class": "Name", "path": "/nick" },
      { "class": "Name", "path": "/famnick" },
      { "class": "Name", "path": "/title" },
      { "class": "Name", "path": "/suffix" },
      { "class": "Surname", "path": "/surname" },
      { "class": "PlaceName", "path": "/value" },
      { "class": "Place", "path": "/title" },
      { "class": "Place", "path": "/code" },
      { "class": "Tag", "path": "/name" }
    ]
  },
  "rules": [
    {
      "id": "private.object.exclude",
      "class": "private",
      "objectClass": ["Person", "Family", "Event", "Place", "Source", "Citation", "Repository", "Media", "Note"],
      "path": "/private",
      "action": "exclude_object",
      "phase": "classify",
      "summary": "A primary object with private true is excluded. One that was synced before is withdrawn.",
      "source": "sync.md 5.1",
      "server": "detect"
    },
    {
      "id": "private.name.hold_person",
      "class": "private",
      "objectClass": ["Person"],
      "path": "/primary_name/private",
      "action": "exclude_object",
      "phase": "classify",
      "summary": "A person whose primary name is private is held whole: a person cannot exist in the cloud without a name.",
      "source": "sync.md 5.1",
      "server": "detect",
      "params": { "disposition": "hold" }
    },
    {
      "id": "private.element.alternate_names",
      "class": "private",
      "objectClass": ["Person"],
      "path": "/alternate_names/*",
      "action": "filter_element",
      "phase": "elements",
      "summary": "A private alternate name is removed from the list.",
      "source": "sync.md 5.1",
      "server": "detect",
      "params": { "when": "private" }
    },
    {
      "id": "private.element.event_ref_list",
      "class": "private",
      "objectClass": ["Person", "Family"],
      "path": "/event_ref_list/*",
      "action": "filter_element",
      "phase": "elements",
      "summary": "A private event reference is removed from the list.",
      "source": "sync.md 5.1",
      "server": "detect",
      "params": { "when": "private" }
    },
    {
      "id": "private.element.media_list",
      "class": "private",
      "objectClass": ["Person", "Family", "Event", "Place", "Source", "Citation"],
      "path": "/media_list/*",
      "action": "filter_element",
      "phase": "elements",
      "summary": "A private media reference is removed from the list.",
      "source": "sync.md 5.1",
      "server": "detect",
      "params": { "when": "private" }
    },
    {
      "id": "private.element.child_ref_list",
      "class": "private",
      "objectClass": ["Family"],
      "path": "/child_ref_list/*",
      "action": "filter_element",
      "phase": "elements",
      "summary": "A private child reference is removed from the list.",
      "source": "sync.md 5.1",
      "server": "detect",
      "params": { "when": "private" }
    },
    {
      "id": "private.element.attribute_list",
      "class": "private",
      "objectClass": ["Person", "Family", "Event", "Media"],
      "path": "/**/attribute_list/*",
      "action": "filter_element",
      "phase": "elements",
      "summary": "A private attribute is removed, on the object and on its event and media references.",
      "source": "sync.md 5.1",
      "server": "detect",
      "params": { "when": "private", "elementClass": "Attribute" }
    },
    {
      "id": "private.element.src_attribute_list",
      "class": "private",
      "objectClass": ["Source", "Citation"],
      "path": "/attribute_list/*",
      "action": "filter_element",
      "phase": "elements",
      "summary": "A private source attribute is removed from the list.",
      "source": "sync.md 5.1",
      "server": "detect",
      "params": { "when": "private", "elementClass": "SrcAttribute" }
    },
    {
      "id": "private.element.urls",
      "class": "private",
      "objectClass": ["Person", "Place", "Repository"],
      "path": "/urls/*",
      "action": "filter_element",
      "phase": "elements",
      "summary": "A private URL is removed from the list.",
      "source": "sync.md 5.1",
      "server": "detect",
      "params": { "when": "private" }
    },
    {
      "id": "private.element.address_list",
      "class": "private",
      "objectClass": ["Person", "Repository"],
      "path": "/address_list/*",
      "action": "filter_element",
      "phase": "elements",
      "summary": "A private address is removed from the list. The whole list is local-only anyway (contact.address_list).",
      "source": "sync.md 5.1",
      "server": "detect",
      "params": { "when": "private" }
    },
    {
      "id": "private.element.lds_ord_list",
      "class": "private",
      "objectClass": ["Person"],
      "path": "/lds_ord_list/*",
      "action": "filter_element",
      "phase": "elements",
      "summary": "A private LDS ordinance is removed from the list. The whole list is local-only anyway (birth.lds_ord).",
      "source": "sync.md 5.1",
      "server": "detect",
      "params": { "when": "private" }
    },
    {
      "id": "private.element.person_ref_list",
      "class": "private",
      "objectClass": ["Person"],
      "path": "/person_ref_list/*",
      "action": "filter_element",
      "phase": "elements",